<?xml version="1.0" encoding="UTF-8"?>
<!DOCTYPE def.pages_models SYSTEM "../dtd/dtd.pages_models.def.dtd">

<def.pages_models>

    <model id="TMLNR_GTPG_WLC">
        <model.id value ="TMLNR_GTPG_WLC" />
        <model.files.css>
            <std>
                <!--<media name="media" value="screen and (min-width: 250px) and (max-width: 1400px);{wos/sysdir:stylesheet_dir_uri}/r/s/mdl15p.m.css?{wos/systx:now}" />-->
                <file name="std" value="{wos/sysdir:stylesheet_dir_uri}/r/s/mdl15p.m.css?{wos/systx:now}" />
                <file name="std" value="{wos/sysdir:stylesheet_dir_uri}/r/c.c/com.css" />
                <file name="std" value="{wos/sysdir:stylesheet_dir_uri}/r/s/model21.css?{wos/systx:now}" />
                <!-- <file name="std" value="{wos/sysdir:stylesheet_dir_uri}/r/s/model2.css?{wos/systx:now}" /> -->
                <!-- <file name="std" value="{wos/sysdir:stylesheet_dir_uri}/r/d/profil-hdr-max.d.css?{wos/systx:now}" /> (01-07-15) -->
                <file name="std" value="{wos/sysdir:stylesheet_dir_uri}/r/csam/pflbioplus_asdbox.csam.css?{wos/systx:now}" />
                <!-- <file name="std" value="{wos/sysdir:stylesheet_dir_uri}/r/d/user_socprint.d.css?{wos/systx:now}" /> -->
                <file name="std" value="{wos/sysdir:stylesheet_dir_uri}/r/d/aside_right_rest.d.css?{wos/systx:now}" />
                <!-- <file name="std" value="{wos/sysdir:stylesheet_dir_uri}/r/d/hdr-with-co.d.css?{wos/systx:now}" /> -->
                <file name="std" value="{wos/sysdir:stylesheet_dir_uri}/r/d/acc-header.d.css?{wos/systx:now}" />
                <!-- Account Feed n'est disponible que pour ce modoèle donc, déclaré comme vfiles de Model -->
                <!-- Cependant, il a été créé pour une dvt, il garde donc son extension *.d -->
                <file name="std" value="{wos/sysdir:stylesheet_dir_uri}/r/d/accountFeed.d.css?{wos/systx:now}" />
                <file name="std" value="{wos/sysdir:stylesheet_dir_uri}/r/csam/ua_event_corner.csam.css?{wos/systx:now}" />
                <file name="std" value="{wos/sysdir:stylesheet_dir_uri}/r/d/legals.dvt.css?{wos/systx:now}" />
                <file name="std" value="{wos/sysdir:stylesheet_dir_uri}/r/c.c/perfect-scrollbar-0.4.6.min.css" />
                <file name="std" value="{wos/sysdir:stylesheet_dir_uri}/r/c.c/font-awesome.min.css?{wos/systx:now}" />
            </std>
        </model.files.css>
        <model.files.js>
        </model.files.js>
    </model>
	
    <model id="TMLNR_GTPG_RU">
        <model.id value ="TMLNR_GTPG_RU" />
        <model.files.css>
            <std>
                <!--<media name="media" value="screen and (min-width: 250px) and (max-width: 1400px);{wos/sysdir:stylesheet_dir_uri}/r/s/mdl15p.m.css?{wos/systx:now}" />-->
                <file name="std" value="{wos/sysdir:stylesheet_dir_uri}/r/s/mdl15p.m.css?{wos/systx:now}" />
                <file name="std" value="{wos/sysdir:stylesheet_dir_uri}/r/c.c/com.css" />
                <file name="std" value="{wos/sysdir:stylesheet_dir_uri}/r/s/model21.css?{wos/systx:now}" />
                <!-- <file name="std" value="{wos/sysdir:stylesheet_dir_uri}/r/s/model2.css?{wos/systx:now}" /> -->
                <!-- <file name="std" value="{wos/sysdir:stylesheet_dir_uri}/r/d/profil-hdr-max.d.css?{wos/systx:now}" /> (01-07-15) -->
                <file name="std" value="{wos/sysdir:stylesheet_dir_uri}/r/csam/pflbioplus_asdbox.csam.css?{wos/systx:now}" />
                <file name="std" value="{wos/sysdir:stylesheet_dir_uri}/r/csam/asdapps.csam.css?{wos/systx:now}" />
                <!-- <file name="std" value="{wos/sysdir:stylesheet_dir_uri}/r/d/user_socprint.d.css?{wos/systx:now}" /> -->
                
                <file name="std" value="{wos/sysdir:stylesheet_dir_uri}/r/d/aside_right_rest.d.css?{wos/systx:now}" />
                <!--<file name="std" value="{wos/sysdir:stylesheet_dir_uri}/r/d/hdr-with-co.d.css?{wos/systx:now}" />-->
                <file name="std" value="{wos/sysdir:stylesheet_dir_uri}/r/d/acc-header.d.css?{wos/systx:now}" />
                <!-- <file name="std" value="{wos/sysdir:stylesheet_dir_uri}/r/c.c/badges.css?{wos/systx:now}" /> -->
                <!-- Account Feed n'est disponible que pour ce modèle donc, déclaré comme vfiles de Model -->
                <!-- Cependant, il a été créé pour une dvt, il garde donc son extension *.d -->
                <file name="std" value="{wos/sysdir:stylesheet_dir_uri}/r/d/accountFeed.d.css?{wos/systx:now}" />
                <file name="std" value="{wos/sysdir:stylesheet_dir_uri}/r/csam/ua_event_corner.csam.css?{wos/systx:now}" />
                <!--<file name="std" value="{wos/sysdir:stylesheet_dir_uri}/r/d/legals.dvt.css?{wos/systx:now}" />-->
                
                <file name="std" value="{wos/sysdir:stylesheet_dir_uri}/r/s/tqs.m.css?{wos/systx:now}" />
                <file name="std" value="{wos/sysdir:stylesheet_dir_uri}/r/c.c/crpr.min.css?{wos/systx:now}" />
                
                <file name="std" value="{wos/sysdir:stylesheet_dir_uri}/r/c.c/perfect-scrollbar-0.4.6.min.css" />
                <file name="std" value="{wos/sysdir:stylesheet_dir_uri}/r/c.c/jquery-ui.min.css" />
                <file name="std" value="{wos/sysdir:stylesheet_dir_uri}/r/c.c/jquery.datetimepicker.css" />
                <file name="std" value="{wos/sysdir:stylesheet_dir_uri}/r/c.c/font-awesome.min.css" />
            </std>
        </model.files.css>
        <model.files.js>
        </model.files.js>
    </model>
	
    <model id="TMLNR_GTPG_RO">
        <model.id value ="TMLNR_GTPG_RO" />
        <model.files.css>
            <std>
                <!--<media name="media" value="screen and (min-width: 250px) and (max-width: 1400px);{wos/sysdir:stylesheet_dir_uri}/r/s/mdl15p.m.css?{wos/systx:now}" />-->
                <file name="std" value="{wos/sysdir:stylesheet_dir_uri}/r/s/mdl15p.m.css?{wos/systx:now}" />
                <file name="std" value="{wos/sysdir:stylesheet_dir_uri}/r/c.c/com.css" />
                <file name="std" value="{wos/sysdir:stylesheet_dir_uri}/r/s/model21.css?{wos/systx:now}" />
                <!-- <file name="std" value="{wos/sysdir:stylesheet_dir_uri}/r/s/model2.css?{wos/systx:now}" /> -->
                <!-- <file name="std" value="{wos/sysdir:stylesheet_dir_uri}/r/d/profil-hdr-max.d.css?{wos/systx:now}" /> (01-07-15) -->
                <file name="std" value="{wos/sysdir:stylesheet_dir_uri}/r/csam/pflbioplus_asdbox.csam.css?{wos/systx:now}" />
                <file name="std" value="{wos/sysdir:stylesheet_dir_uri}/r/csam/asdapps.csam.css?{wos/systx:now}" />
                <!-- <file name="std" value="{wos/sysdir:stylesheet_dir_uri}/r/d/user_socprint.d.css?{wos/systx:now}" /> -->

                <!--<file name="std" value="{wos/sysdir:stylesheet_dir_uri}/r/d/hdr-with-co.d.css?{wos/systx:now}" />--> <!-- UnUSed -->
                <file name="std" value="{wos/sysdir:stylesheet_dir_uri}/r/d/acc-header.d.css?{wos/systx:now}" />
                <!-- <file name="std" value="{wos/sysdir:stylesheet_dir_uri}/r/c.c/badges.css?{wos/systx:now}" /> -->
                <!-- Account Feed n'est disponible que pour ce modèle donc, déclaré comme vfiles de Model -->
                <!-- Cependant, il a été créé pour une dvt, il garde donc son extension *.d -->
                <file name="std" value="{wos/sysdir:stylesheet_dir_uri}/r/d/accountFeed.d.css?{wos/systx:now}" />
                <file name="std" value="{wos/sysdir:stylesheet_dir_uri}/r/csam/ua_event_corner.csam.css?{wos/systx:now}" />
                <!--<file name="std" value="{wos/sysdir:stylesheet_dir_uri}/r/csam/tia.csam.css?{wos/systx:now}" />-->
                
                <file name="std" value="{wos/sysdir:stylesheet_dir_uri}/r/s/tqs.m.css?{wos/systx:now}" />
                <file name="std" value="{wos/sysdir:stylesheet_dir_uri}/r/c.c/crpr.min.css?{wos/systx:now}" />
                
                <!--<file name="std" value="{wos/sysdir:stylesheet_dir_uri}/r/d/legals.dvt.css?{wos/systx:now}" />--> <!-- UnUSed -->
                <file name="std" value="{wos/sysdir:stylesheet_dir_uri}/r/c.c/perfect-scrollbar-0.4.6.min.css" />
                <file name="std" value="{wos/sysdir:stylesheet_dir_uri}/r/c.c/jquery-ui.min.css" />
                <file name="std" value="{wos/sysdir:stylesheet_dir_uri}/r/c.c/font-awesome.min.css?{wos/systx:now}" />
            </std>
        </model.files.css>
        <model.files.js>
        </model.files.js>
    </model>
	
    <model id="TRPG_GTPG_WLC">
        <model.id value ="TRPG_GTPG_WLC" />
        <model.files.css>
            <std>
                <!--<media name="media" value="screen and (min-width: 250px) and (max-width: 1400px);{wos/sysdir:stylesheet_dir_uri}/r/s/mdl15p.m.css?{wos/systx:now}" />-->
                <file name="std" value="{wos/sysdir:stylesheet_dir_uri}/r/s/mdl15p.m.css?{wos/systx:now}" />
                <file name="std" value="{wos/sysdir:stylesheet_dir_uri}/r/c.c/com.css" />
                <file name="std" value="{wos/sysdir:stylesheet_dir_uri}/r/s/home_tr.m.css?{wos/systx:now}" />
                <!-- <file name="std" value="{wos/sysdir:stylesheet_dir_uri}/r/c.c/flags-txt.css?{wos/systx:now}" /> -->
                <file name="std" value="{wos/sysdir:stylesheet_dir_uri}/r/s/model21.css?{wos/systx:now}" />
                <!-- <file name="std" value="{wos/sysdir:stylesheet_dir_uri}/r/s/model2.css?{wos/systx:now}" /> -->
                <!-- <file name="std" value="{wos/sysdir:stylesheet_dir_uri}/r/d/user_socprint.d.css?{wos/systx:now}" /> -->
                <file name="std" value="{wos/sysdir:stylesheet_dir_uri}/r/d/aside_right_rest.d.css?{wos/systx:now}" />
                <!-- <file name="std" value="{wos/sysdir:stylesheet_dir_uri}/r/d/hdr-with-co.d.css?{wos/systx:now}" /> -->
                <!-- <file name="std" value="{wos/sysdir:stylesheet_dir_uri}/r/d/acc-header.d.css?{wos/systx:now}" /> -->